{"protocol_version":"1.0","request_id":"list-v8","operation":"list_archive_members","payload":{"map_path":"C:\\Users\\hp\\Documents\\Warcraft III\\Hero Team Wars\\builds\\mcp\\hero-team-wars\\a867c357-0f07-4e33-8e64-5854866357fd\\HeroTeamWars_v8-custom-heroes-shared-altar_a867c357-0f07-4e33-8e64-5854866357fd.w3m"}}
