{"protocol_version":"1.0","request_id":"script-v8","operation":"read_script_source","payload":{"map_path":"C:\\Users\\hp\\Documents\\Warcraft III\\Hero Team Wars\\builds\\mcp\\hero-team-wars\\a867c357-0f07-4e33-8e64-5854866357fd\\HeroTeamWars_v8-custom-heroes-shared-altar_a867c357-0f07-4e33-8e64-5854866357fd.w3m","archive_path":"war3map.j"}}
